{
  "schema_version": "1.0",
  "id": "10101010-1010-4010-8010-101010101010",
  "created_at": "2026-10-07T02:00:00+00:00",
  "author": { "nickname": "デモ：そら" },
  "theme": {
    "title": "AIの買い物代行に「譲れない条件」をどう伝えるか",
    "rq": "模擬購入課題で、AIエージェントへの条件の伝え方は、購入条件への違反率と確認の負担にどう影響するか？",
    "interest_connection": "好きな商品の選び方を他人に説明する難しさへの関心。これは動作確認用の架空のテーマです。",
    "contribution_types": ["problem"],
    "novelty": { "status": "unverified", "claim": "途中で変化する好みと、購入の直前に守るべき条件を区別して調べる仮説。先行研究との差は未確認。" },
    "source_ids": [],
    "technology": { "capability": "条件に従って複数の候補を比較するAIエージェント", "availability": "unverified", "conditions": "使用するモデル、利用費用、ツールの条件はこれから確認。実際の購入は行わない。", "source_ids": [] },
    "evaluation": {
      "comparison": "自由文で条件を伝える場合と、条件を構造化して伝える場合を比較する。",
      "metrics": ["条件違反率", "確認を求めた回数", "判断理由への納得の記述"],
      "procedure": "架空の商品と条件を用意して模擬購入を繰り返す。モデルと設定を揃え、失敗の種類も記録する。",
      "resources": "模擬商品データと、条件を変化させるシナリオ。",
      "limitations": "模擬課題での結果であり、実際の購買行動にそのまま一般化しない。"
    },
    "pilot": "少数の架空商品で2種類の条件の伝え方を試し、違反を判定できるか確かめる。",
    "open_questions": ["最も近い先行研究は何か", "条件違反を誰がどの基準で判断するか"]
  },
  "sources": []
}
